<?xml version="1.0" encoding="UTF-8" ?>
<NETWORK xmlns="http://www.opentrafficsim.org/ots" xmlns:ots="http://www.opentrafficsim.org/ots" xmlns:xsi="http://www.w3.org/2001/XMLSchema-instance"
	xsi:schemaLocation="http://www.opentrafficsim.org/ots http://www.opentrafficsim.org/docs/current/ots-network.xsd"
	xmlns:xi="http://www.w3.org/2001/XInclude">

	<DEFINITIONS>

		<GLOBAL />

		<GTUTYPE NAME="CAR" />

		<GTU NAME="CAR" GTUTYPE="CAR" LENGTH="CONST(4.5) m" WIDTH="CONST(2) m" MAXSPEED="CONST(80) km/h" />

		<ROADTYPE NAME="HIGHWAY" DEFAULTLANEWIDTH="3m" DEFAULTOVERTAKING="NONE" DEFAULTLANEKEEPING="KEEPLANE">
			<SPEEDLIMIT GTUTYPE="CAR" LEGALSPEEDLIMIT="100 km/h" />
		</ROADTYPE>
		<ROADTYPE NAME="OUTSIDECITY" DEFAULTLANEWIDTH="3m" DEFAULTOVERTAKING="NONE" DEFAULTLANEKEEPING="KEEPLANE">
			<SPEEDLIMIT GTUTYPE="CAR" LEGALSPEEDLIMIT="80 km/h" />
		</ROADTYPE>
		<ROADTYPE NAME="CITYSTREET" DEFAULTLANEWIDTH="3m" DEFAULTOVERTAKING="NONE" DEFAULTLANEKEEPING="KEEPLANE">
			<SPEEDLIMIT GTUTYPE="CAR" LEGALSPEEDLIMIT="50 km/h" />
		</ROADTYPE>

		<ROADLAYOUT NAME="RT1ln_ref-3" ROADTYPE="CITYSTREET">
			<LANE NAME="A1" OFFSET="-6m" WIDTH="3m" DIRECTION="FORWARD" COLOR="BLACK" />
		</ROADLAYOUT>

		<ROADLAYOUT NAME="RT1ln_ref-2" ROADTYPE="CITYSTREET">
			<LANE NAME="A1" OFFSET="-9m" WIDTH="3m" DIRECTION="FORWARD" COLOR="BLACK" />
		</ROADLAYOUT>

		<ROADLAYOUT NAME="RT1ln_ref-1" ROADTYPE="CITYSTREET">
			<LANE NAME="A1" OFFSET="-12m" WIDTH="3m" DIRECTION="FORWARD" COLOR="BLACK" />
		</ROADLAYOUT>

		<ROADLAYOUT NAME="RT1ln_ref0" ROADTYPE="CITYSTREET">
			<LANE NAME="A1" OFFSET="-15m" WIDTH="3m" DIRECTION="FORWARD" COLOR="BLACK" />
		</ROADLAYOUT>

		<ROADLAYOUT NAME="RT1ln_ref1" ROADTYPE="CITYSTREET">
			<LANE NAME="A1" OFFSET="-18m" WIDTH="3m" DIRECTION="FORWARD" COLOR="BLACK" />
		</ROADLAYOUT>

		<ROADLAYOUT NAME="RT1ln_ref2" ROADTYPE="CITYSTREET">
			<LANE NAME="A1" OFFSET="-21m" WIDTH="3m" DIRECTION="FORWARD" COLOR="BLACK" />
		</ROADLAYOUT>

		<ROADLAYOUT NAME="RT2ln_ref-3" ROADTYPE="OUTSIDECITY">
			<LANE NAME="A1" OFFSET="-6m" WIDTH="3m" DIRECTION="FORWARD" COLOR="BLACK" />
			<STRIPE TYPE="DASHED" OFFSET="-4.5m" />
			<LANE NAME="A2" OFFSET="-3m" WIDTH="3m" DIRECTION="FORWARD" COLOR="BLACK" />
		</ROADLAYOUT>

		<ROADLAYOUT NAME="RT2ln_ref-2" ROADTYPE="OUTSIDECITY">
			<LANE NAME="A1" OFFSET="-9m" WIDTH="3m" DIRECTION="FORWARD" COLOR="BLACK" />
			<STRIPE TYPE="DASHED" OFFSET="-7.5m" />
			<LANE NAME="A2" OFFSET="-6m" WIDTH="3m" DIRECTION="FORWARD" COLOR="BLACK" />
		</ROADLAYOUT>

		<ROADLAYOUT NAME="RT2ln_ref-1" ROADTYPE="OUTSIDECITY">
			<LANE NAME="A1" OFFSET="-12m" WIDTH="3m" DIRECTION="FORWARD" COLOR="BLACK" />
			<STRIPE TYPE="DASHED" OFFSET="-10.5m" />
			<LANE NAME="A2" OFFSET="-9m" WIDTH="3m" DIRECTION="FORWARD" COLOR="BLACK" />
		</ROADLAYOUT>

		<ROADLAYOUT NAME="RT2ln_ref0" ROADTYPE="OUTSIDECITY">
			<LANE NAME="A1" OFFSET="-15m" WIDTH="3m" DIRECTION="FORWARD" COLOR="BLACK" />
			<STRIPE TYPE="DASHED" OFFSET="-13.5m" />
			<LANE NAME="A2" OFFSET="-12m" WIDTH="3m" DIRECTION="FORWARD" COLOR="BLACK" />
		</ROADLAYOUT>

		<ROADLAYOUT NAME="RT2ln_ref1" ROADTYPE="OUTSIDECITY">
			<LANE NAME="A1" OFFSET="-18m" WIDTH="3m" DIRECTION="FORWARD" COLOR="BLACK" />
			<STRIPE TYPE="DASHED" OFFSET="-16.5m" />
			<LANE NAME="A2" OFFSET="-15m" WIDTH="3m" DIRECTION="FORWARD" COLOR="BLACK" />
		</ROADLAYOUT>

		<ROADLAYOUT NAME="RT2ln_ref2" ROADTYPE="OUTSIDECITY">
			<LANE NAME="A1" OFFSET="-21m" WIDTH="3m" DIRECTION="FORWARD" COLOR="BLACK" />
			<STRIPE TYPE="DASHED" OFFSET="-19.5m" />
			<LANE NAME="A2" OFFSET="-18m" WIDTH="3m" DIRECTION="FORWARD" COLOR="BLACK" />
		</ROADLAYOUT>

		<ROADLAYOUT NAME="RT2ln_ref4" ROADTYPE="OUTSIDECITY">
			<LANE NAME="A1" OFFSET="-27m" WIDTH="3m" DIRECTION="FORWARD" COLOR="BLACK" />
			<STRIPE TYPE="DASHED" OFFSET="-25.5m" />
			<LANE NAME="A2" OFFSET="-24m" WIDTH="3m" DIRECTION="FORWARD" COLOR="BLACK" />
		</ROADLAYOUT>

		<ROADLAYOUT NAME="RT3ln_ref-2" ROADTYPE="OUTSIDECITY">
			<LANE NAME="A1" OFFSET="-9m" WIDTH="3m" DIRECTION="FORWARD" COLOR="BLACK" />
			<STRIPE TYPE="DASHED" OFFSET="-7.5m" />
			<LANE NAME="A2" OFFSET="-6m" WIDTH="3m" DIRECTION="FORWARD" COLOR="BLACK" />
			<STRIPE TYPE="DASHED" OFFSET="-4.5m" />
			<LANE NAME="A3" OFFSET="-3m" WIDTH="3m" DIRECTION="FORWARD" COLOR="BLACK" />
		</ROADLAYOUT>

		<ROADLAYOUT NAME="RT3ln_ref0" ROADTYPE="OUTSIDECITY">
			<LANE NAME="A1" OFFSET="-15m" WIDTH="3m" DIRECTION="FORWARD" COLOR="BLACK" />
			<STRIPE TYPE="DASHED" OFFSET="-13.5m" />
			<LANE NAME="A2" OFFSET="-12m" WIDTH="3m" DIRECTION="FORWARD" COLOR="BLACK" />
			<STRIPE TYPE="DASHED" OFFSET="-10.5m" />
			<LANE NAME="A3" OFFSET="-9m" WIDTH="3m" DIRECTION="FORWARD" COLOR="BLACK" />
		</ROADLAYOUT>

		<ROADLAYOUT NAME="RT3ln_ref1" ROADTYPE="OUTSIDECITY">
			<LANE NAME="A1" OFFSET="-18m" WIDTH="3m" DIRECTION="FORWARD" COLOR="BLACK" />
			<STRIPE TYPE="DASHED" OFFSET="-16.5m" />
			<LANE NAME="A2" OFFSET="-15m" WIDTH="3m" DIRECTION="FORWARD" COLOR="BLACK" />
			<STRIPE TYPE="DASHED" OFFSET="-13.5m" />
			<LANE NAME="A3" OFFSET="-12m" WIDTH="3m" DIRECTION="FORWARD" COLOR="BLACK" />
		</ROADLAYOUT>

		<ROADLAYOUT NAME="RT3ln_ref2" ROADTYPE="OUTSIDECITY">
			<LANE NAME="A1" OFFSET="-21m" WIDTH="3m" DIRECTION="FORWARD" COLOR="BLACK" />
			<STRIPE TYPE="DASHED" OFFSET="-19.5m" />
			<LANE NAME="A2" OFFSET="-18m" WIDTH="3m" DIRECTION="FORWARD" COLOR="BLACK" />
			<STRIPE TYPE="DASHED" OFFSET="-16.5m" />
			<LANE NAME="A3" OFFSET="-15m" WIDTH="3m" DIRECTION="FORWARD" COLOR="BLACK" />
		</ROADLAYOUT>

		<ROADLAYOUT NAME="RT3ln_ref4" ROADTYPE="OUTSIDECITY">
			<LANE NAME="A1" OFFSET="-27m" WIDTH="3m" DIRECTION="FORWARD" COLOR="BLACK" />
			<STRIPE TYPE="DASHED" OFFSET="-25.5m" />
			<LANE NAME="A2" OFFSET="-24m" WIDTH="3m" DIRECTION="FORWARD" COLOR="BLACK" />
			<STRIPE TYPE="DASHED" OFFSET="-22.5m" />
			<LANE NAME="A3" OFFSET="-21m" WIDTH="3m" DIRECTION="FORWARD" COLOR="BLACK" />
		</ROADLAYOUT>

		<ROADLAYOUT NAME="RT4ln_ref0" ROADTYPE="OUTSIDECITY">
			<LANE NAME="A1" OFFSET="-15m" WIDTH="3m" DIRECTION="FORWARD" COLOR="BLACK" />
			<STRIPE TYPE="DASHED" OFFSET="-13.5m" />
			<LANE NAME="A2" OFFSET="-12m" WIDTH="3m" DIRECTION="FORWARD" COLOR="BLACK" />
			<STRIPE TYPE="DASHED" OFFSET="-10.5m" />
			<LANE NAME="A3" OFFSET="-9m" WIDTH="3m" DIRECTION="FORWARD" COLOR="BLACK" />
			<STRIPE TYPE="DASHED" OFFSET="-7.5m" />
			<LANE NAME="A4" OFFSET="-6m" WIDTH="3m" DIRECTION="FORWARD" COLOR="BLACK" />
		</ROADLAYOUT>

		<ROADLAYOUT NAME="RT4ln_ref1" ROADTYPE="OUTSIDECITY">
			<LANE NAME="A1" OFFSET="-18m" WIDTH="3m" DIRECTION="FORWARD" COLOR="BLACK" />
			<STRIPE TYPE="DASHED" OFFSET="-16.5m" />
			<LANE NAME="A2" OFFSET="-15m" WIDTH="3m" DIRECTION="FORWARD" COLOR="BLACK" />
			<STRIPE TYPE="DASHED" OFFSET="-13.5m" />
			<LANE NAME="A3" OFFSET="-12m" WIDTH="3m" DIRECTION="FORWARD" COLOR="BLACK" />
			<STRIPE TYPE="DASHED" OFFSET="-10.5m" />
			<LANE NAME="A4" OFFSET="-9m" WIDTH="3m" DIRECTION="FORWARD" COLOR="BLACK" />
		</ROADLAYOUT>

		<ROADLAYOUT NAME="RT4ln_ref2" ROADTYPE="OUTSIDECITY">
			<LANE NAME="A1" OFFSET="-21m" WIDTH="3m" DIRECTION="FORWARD" COLOR="BLACK" />
			<STRIPE TYPE="DASHED" OFFSET="-19.5m" />
			<LANE NAME="A2" OFFSET="-18m" WIDTH="3m" DIRECTION="FORWARD" COLOR="BLACK" />
			<STRIPE TYPE="DASHED" OFFSET="-16.5m" />
			<LANE NAME="A3" OFFSET="-15m" WIDTH="3m" DIRECTION="FORWARD" COLOR="BLACK" />
			<STRIPE TYPE="DASHED" OFFSET="-13.5m" />
			<LANE NAME="A4" OFFSET="-12m" WIDTH="3m" DIRECTION="FORWARD" COLOR="BLACK" />
		</ROADLAYOUT>

		<ROADLAYOUT NAME="RT4ln_ref4" ROADTYPE="OUTSIDECITY">
			<LANE NAME="A1" OFFSET="-27m" WIDTH="3m" DIRECTION="FORWARD" COLOR="BLACK" />
			<STRIPE TYPE="DASHED" OFFSET="-25.5m" />
			<LANE NAME="A2" OFFSET="-24m" WIDTH="3m" DIRECTION="FORWARD" COLOR="BLACK" />
			<STRIPE TYPE="DASHED" OFFSET="-22.5m" />
			<LANE NAME="A3" OFFSET="-21m" WIDTH="3m" DIRECTION="FORWARD" COLOR="BLACK" />
			<STRIPE TYPE="DASHED" OFFSET="-19.5m" />
			<LANE NAME="A4" OFFSET="-18m" WIDTH="3m" DIRECTION="FORWARD" COLOR="BLACK" />
		</ROADLAYOUT>

		<ROADLAYOUT NAME="RT5ln_ref1" ROADTYPE="OUTSIDECITY">
			<LANE NAME="A1" OFFSET="-18m" WIDTH="3m" DIRECTION="FORWARD" COLOR="BLACK" />
			<STRIPE TYPE="DASHED" OFFSET="-16.5m" />
			<LANE NAME="A2" OFFSET="-15m" WIDTH="3m" DIRECTION="FORWARD" COLOR="BLACK" />
			<STRIPE TYPE="DASHED" OFFSET="-13.5m" />
			<LANE NAME="A3" OFFSET="-12m" WIDTH="3m" DIRECTION="FORWARD" COLOR="BLACK" />
			<STRIPE TYPE="DASHED" OFFSET="-10.5m" />
			<LANE NAME="A4" OFFSET="-9m" WIDTH="3m" DIRECTION="FORWARD" COLOR="BLACK" />
			<STRIPE TYPE="DASHED" OFFSET="-7.5m" />
			<LANE NAME="A5" OFFSET="-6m" WIDTH="3m" DIRECTION="FORWARD" COLOR="BLACK" />
		</ROADLAYOUT>

		<ROADLAYOUT NAME="RT5ln_ref2" ROADTYPE="OUTSIDECITY">
			<LANE NAME="A1" OFFSET="-21m" WIDTH="3m" DIRECTION="FORWARD" COLOR="BLACK" />
			<STRIPE TYPE="DASHED" OFFSET="-19.5m" />
			<LANE NAME="A2" OFFSET="-18m" WIDTH="3m" DIRECTION="FORWARD" COLOR="BLACK" />
			<STRIPE TYPE="DASHED" OFFSET="-16.5m" />
			<LANE NAME="A3" OFFSET="-15m" WIDTH="3m" DIRECTION="FORWARD" COLOR="BLACK" />
			<STRIPE TYPE="DASHED" OFFSET="-13.5m" />
			<LANE NAME="A4" OFFSET="-12m" WIDTH="3m" DIRECTION="FORWARD" COLOR="BLACK" />
			<STRIPE TYPE="DASHED" OFFSET="-10.5m" />
			<LANE NAME="A5" OFFSET="-9m" WIDTH="3m" DIRECTION="FORWARD" COLOR="BLACK" />
		</ROADLAYOUT>

		<ROADLAYOUT NAME="RT6ln_ref1" ROADTYPE="OUTSIDECITY">
			<LANE NAME="A1" OFFSET="-18m" WIDTH="3m" DIRECTION="FORWARD" COLOR="BLACK" />
			<STRIPE TYPE="DASHED" OFFSET="-16.5m" />
			<LANE NAME="A2" OFFSET="-15m" WIDTH="3m" DIRECTION="FORWARD" COLOR="BLACK" />
			<STRIPE TYPE="DASHED" OFFSET="-13.5m" />
			<LANE NAME="A3" OFFSET="-12m" WIDTH="3m" DIRECTION="FORWARD" COLOR="BLACK" />
			<STRIPE TYPE="DASHED" OFFSET="-10.5m" />